{
  "$schema": "https://json-schema.org/draft/2020-12/schema",
  "$defs": {
    "ReorderRule": {
      "additionalProperties": false,
      "properties": {
        "product_id": {
          "pattern": "^[0-9a-f]{8}-[0-9a-f]{4}-[0-9a-f]{4}-[0-9a-f]{4}-[0-9a-f]{12}$",
          "title": "Product Id",
          "type": "string"
        },
        "stock_location_id": {
          "pattern": "^[0-9a-f]{8}-[0-9a-f]{4}-[0-9a-f]{4}-[0-9a-f]{4}-[0-9a-f]{12}$",
          "title": "Stock Location Id",
          "type": "string"
        },
        "reorder_point": {
          "minimum": 0,
          "title": "Reorder Point",
          "type": "integer"
        },
        "safety_stock": {
          "minimum": 0,
          "title": "Safety Stock",
          "type": "integer"
        },
        "review_cadence_days": {
          "exclusiveMinimum": 0,
          "title": "Review Cadence Days",
          "type": "integer"
        },
        "history_window_days": {
          "exclusiveMinimum": 0,
          "title": "History Window Days",
          "type": "integer"
        },
        "minimum_order_quantity": {
          "exclusiveMinimum": 0,
          "title": "Minimum Order Quantity",
          "type": "integer"
        }
      },
      "required": [
        "product_id",
        "stock_location_id",
        "reorder_point",
        "safety_stock",
        "review_cadence_days",
        "history_window_days",
        "minimum_order_quantity"
      ],
      "title": "ReorderRule",
      "type": "object"
    }
  },
  "additionalProperties": false,
  "properties": {
    "contract_version": {
      "const": "reorder-config-1.0.0",
      "title": "Contract Version",
      "type": "string"
    },
    "policy_version": {
      "const": "periodic-review-stock-position-1.0.0",
      "title": "Policy Version",
      "type": "string"
    },
    "business_timezone": {
      "const": "UTC",
      "title": "Business Timezone",
      "type": "string"
    },
    "review_anchor_at": {
      "pattern": "^\\d{4}-\\d{2}-\\d{2}T\\d{2}:\\d{2}:\\d{2}(?:\\.\\d{1,6})?(?:Z|\\+00:00)$",
      "title": "Review Anchor At",
      "type": "string"
    },
    "known_at": {
      "pattern": "^\\d{4}-\\d{2}-\\d{2}T\\d{2}:\\d{2}:\\d{2}(?:\\.\\d{1,6})?(?:Z|\\+00:00)$",
      "title": "Known At",
      "type": "string"
    },
    "available_at": {
      "pattern": "^\\d{4}-\\d{2}-\\d{2}T\\d{2}:\\d{2}:\\d{2}(?:\\.\\d{1,6})?(?:Z|\\+00:00)$",
      "title": "Available At",
      "type": "string"
    },
    "rules": {
      "items": {
        "$ref": "#/$defs/ReorderRule"
      },
      "minItems": 1,
      "title": "Rules",
      "type": "array"
    }
  },
  "required": [
    "contract_version",
    "policy_version",
    "business_timezone",
    "review_anchor_at",
    "known_at",
    "available_at",
    "rules"
  ],
  "title": "ReorderConfig",
  "type": "object"
}
